{
  "$schema": "http://json-schema.org/draft-07/schema#",
  "definitions": {
    "positiveNumber": {
      "type": "number",
      "minimum": 0
    },
    "xyzArray": {
      "type": "array",
      "description": "Array of 3 numbers, [x, y, z]",
      "items": { "type": "number" },
      "minItems": 3,
      "maxItems": 3
    },
    "coordinates": {
      "type": "object",
      "additionalProperties": false,
      "required": ["x", "y", "z"],
      "properties": {
        "x": {
          "type": "number"
        },
        "y": {
          "type": "number"
        },
        "z": {
          "type": "number"
        }
      }
    },
    "unitVector": {
      "type": "array",
      "description": "Array of 3 unit directions, [x, y, z]",
      "items": {
        "type": "number",
        "enum": [1, -1]
      },
      "minItems": 3,
      "maxItems": 3
    },
    "boundingBox": {
      "type": "object",
      "description": "The active area (both pipettes can reach) of a fixture on the deck",
      "required": ["xDimension", "yDimension", "zDimension"],
      "properties": {
        "xDimension": { "$ref": "#/definitions/positiveNumber" },
        "yDimension": { "$ref": "#/definitions/positiveNumber" },
        "zDimension": { "$ref": "#/definitions/positiveNumber" }
      }
    },
    "svgsonNode": {
      "type": "object",
      "description": "An svgson node that corresponds to a single svg tag",
      "properties": {
        "name": {
          "type": "string",
          "description": "Element name, like svg, circle, line…"
        },
        "type": {
          "type": "string",
          "description": "Element type like element, text…"
        },
        "value": {
          "type": "string",
          "description": "Element value, used in text nodes."
        },
        "children": {
          "type": "array",
          "description": "List of element children",
          "items": { "$ref": "#/definitions/svgsonNode" }
        },
        "attributes": {
          "type": "object",
          "description": "Attributes for the element"
        }
      }
    }
  },

  "description": "Deck specifications, where x,y,z (0,0,0) is at front the bottom left corner.",
  "type": "object",
  "additionalProperties": false,
  "required": [
    "otId",
    "schemaVersion",
    "cornerOffsetFromOrigin",
    "dimensions",
    "metadata",
    "robot",
    "locations",
    "layers"
  ],
  "properties": {
    "otId": {
      "description": "Unique internal ID generated using UUID",
      "type": "string"
    },
    "schemaVersion": {
      "description": "Schema version of a deck is a single integer",
      "enum": [3]
    },
    "cornerOffsetFromOrigin": {
      "$ref": "#/definitions/xyzArray",
      "description": "Position of left-front-bottom corner of entire deck to robot coordinate system origin"
    },
    "dimensions": {
      "$ref": "#/definitions/xyzArray",
      "description": "Outer dimensions of a deck bounding box"
    },
    "metadata": {
      "description": "Optional metadata about the Deck",
      "type": "object",
      "properties": {
        "displayName": {
          "description": "A short, human-readable name for the deck",
          "type": "string"
        },
        "tags": {
          "description": "Tags to be used in searching for this deck",
          "type": "array",
          "items": {
            "type": "string"
          }
        }
      }
    },
    "robot": {
      "type": "object",
      "required": ["model"],
      "properties": {
        "model": {
          "description": "Model of the robot",
          "type": "string",
          "enum": ["OT-2 Standard", "OT-3 Standard"]
        }
      }
    },
    "locations": {
      "type": "object",
      "required": ["orderedSlots", "calibrationPoints"],
      "properties": {
        "orderedSlots": {
          "type": "array",
          "description": "Ordered slots available for placing labware",
          "items": {
            "type": "object",
            "required": [
              "id",
              "position",
              "boundingBox",
              "displayName",
              "compatibleModuleTypes"
            ],
            "properties": {
              "id": {
                "description": "Unique identifier for slot",
                "type": "string"
              },
              "position": {
                "$ref": "#/definitions/xyzArray"
              },
              "matingSurfaceUnitVector": {
                "$ref": "#/definitions/unitVector",
                "description": "An optional diagonal direction of force, defined by spring location, which governs the mating surface of objects placed in slot."
              },
              "boundingBox": {
                "$ref": "#/definitions/boundingBox"
              },
              "displayName": {
                "description": "A human-readable nickname for this slot Eg \"Slot 1\" or \"Fixed Trash\"",
                "type": "string"
              },
              "compatibleModuleTypes": {
                "description": "An array of module types that can be placed in this slot.",
                "type": "array",
                "items": {
                  "type": "string",
                  "enum": [
                    "magneticModuleType",
                    "temperatureModuleType",
                    "thermocyclerModuleType",
                    "heaterShakerModuleType",
                    "magneticBlockType"
                  ]
                }
              }
            }
          }
        },
        "calibrationPoints": {
          "type": "array",
          "description": "Key points for deck calibration",
          "items": {
            "type": "object",
            "required": ["id", "position", "displayName"],
            "properties": {
              "id": {
                "description": "Unique identifier for calibration point",
                "type": "string"
              },
              "position": {
                "$ref": "#/definitions/xyzArray"
              },
              "displayName": {
                "description": "An optional human-readable nickname for this point Eg \"Slot 3 Cross\" or \"Slot 1 Dot\"",
                "type": "string"
              }
            }
          }
        },
        "fixtures": {
          "type": "array",
          "description": "Fixed position objects on the deck.",
          "items": {
            "type": "object",
            "required": ["id", "displayName"],
            "properties": {
              "id": {
                "description": "Unique identifier for fixed object",
                "type": "string"
              },
              "labware": {
                "description": "Valid labware loadName for fixed object",
                "type": "string"
              },
              "boundingBox": {
                "$ref": "#/definitions/boundingBox"
              },
              "slot": {
                "description": "Slot location of the fixed object",
                "type": "string"
              },
              "position": {
                "$ref": "#/definitions/xyzArray"
              },
              "displayName": {
                "description": "An optional human-readable nickname for this fixture Eg \"Tall Fixed Trash\" or \"Short Fixed Trash\"",
                "type": "string"
              }
            },
            "oneOf": [
              {
                "anyOf": [
                  {
                    "required": ["labware", "slot"]
                  },
                  {
                    "required": ["labware", "position"]
                  }
                ]
              },
              {
                "anyOf": [
                  {
                    "required": ["boundingBox", "slot"]
                  },
                  {
                    "required": ["boundingBox", "position"]
                  }
                ]
              }
            ]
          }
        }
      }
    },
    "layers": {
      "type": "array",
      "description": "Layered feature groups of the deck.",
      "items": {
        "$ref": "#/definitions/svgsonNode"
      }
    },
    "gripperOffsets": {
      "type": "object",
      "description": "Offsets to be added when calculating the coordinates a gripper should go to when picking up or dropping a labware on this deck.",
      "properties": {
        "default": {
          "type": "object",
          "properties": {
            "pickUpOffset": {
              "$ref": "#/definitions/coordinates",
              "description": "Offset added to calculate pick-up coordinates of a labware placed on this deck."
            },
            "dropOffset": {
              "$ref": "#/definitions/coordinates",
              "description": "Offset added to calculate drop coordinates of a labware placed on this deck."
            }
          },
          "required": ["pickUpOffset", "dropOffset"]
        }
      },
      "required": ["default"]
    }
  }
}
